tweet,label,index,Segment,WC,Analytic,Clout,Authentic,Tone,WPS,BigWords,Dic,Linguistic,function,pronoun,ppron,i,we,you,shehe,they,ipron,det,article,number,prep,auxverb,adverb,conj,negate,verb,adj,quantity,Drives,affiliation,achieve,power,Cognition,allnone,cogproc,insight,cause,discrep,tentat,certitude,differ,memory,Affect,tone_pos,tone_neg,emotion,emo_pos,emo_neg,emo_anx,emo_anger,emo_sad,swear,Social,socbehav,prosocial,polite,conflict,moral,comm,socrefs,family,friend,female,male,Culture,politic,ethnicity,tech,Lifestyle,leisure,home,work,money,relig,Physical,health,illness,wellness,mental,substances,sexual,food,death,need,want,acquire,lack,fulfill,fatigue,reward,risk,curiosity,allure,Perception,attention,motion,space,visual,auditory,feeling,time,focuspast,focuspresent,focusfuture,Conversation,netspeak,assent,nonflu,filler,AllPunc,Period,Comma,QMark,Exclam,Apostro,OtherP,Emoji
Cannot cope with uni reading it's doing my head in!,0.0,526,1,10,3.8,1,98.38,,10,10,90,70,60,20,10,10,0,0,0,0,10,10,0,0,20,30,0,0,10,40,0,0,0,0,0,0,30,0,20,10,0,10,0,0,10,0,0,0,0,0,0,0,0,0,0,0,0,0,0,0,0,0,0,0,0,0,0,0,0,0,0,0,0,0,0,0,0,0,20,10,0,0,10,0,0,0,0,0,0,0,0,0,0,0,0,0,0,10,0,0,10,0,0,0,0,0,20,0,0,0,0,0,0,20,0,0,0,10,10,0,0
Nice to see @Cardiffbus have started the new year off with the usual crap service. Just love waiting for a bus that doesn't turn up,1.0,527,1,25,98.41,7.28,96.32,99,12.5,16,92,80,48,4,0,0,0,0,0,0,4,16,12,0,20,8,4,0,4,24,12,4,0,0,0,0,24,0,0,0,0,0,0,0,0,0,16,12,0,4,4,0,0,0,0,4,4,4,0,0,0,0,0,0,0,0,0,0,0,0,0,0,4,0,0,4,0,0,4,0,0,0,0,0,0,0,0,0,0,0,0,0,0,0,0,0,20,12,0,4,4,4,0,0,20,4,4,0,0,0,0,0,0,12,4,0,0,0,4,4,0
"@beesmygod_ the people who are going ""yeah well The Assault Man said he didn't assault her so she's a liar"" are making ME crazier just from exposure",0.0,528,1,27,6.03,97.57,1,1,27,18.52,92.59,74.07,55.56,18.52,18.52,3.7,0,0,11.11,0,0,14.81,11.11,0,3.7,14.81,11.11,3.7,3.7,25.93,3.7,0,7.41,0,0,7.41,22.22,0,7.41,0,3.7,0,0,0,3.7,0,14.81,3.7,7.41,3.7,0,0,0,0,0,0,37.04,14.81,0,0,7.41,3.7,3.7,25.93,0,0,7.41,7.41,0,0,0,0,0,0,0,0,0,0,0,0,0,0,0,0,0,0,0,0,0,0,0,0,0,0,0,0,3.7,3.7,0,3.7,0,0,0,0,0,7.41,11.11,3.7,3.7,0,3.7,0,0,22.22,0,0,0,0,7.41,14.81,0
Ahhh I get to listen to a cement mixer all day. Awesome.,1.0,529,1,12,99,6.61,39.59,99,6,8.33,83.33,83.33,41.67,8.33,8.33,8.33,0,0,0,0,0,16.67,8.33,0,16.67,0,0,0,0,16.67,8.33,16.67,0,0,0,0,16.67,8.33,0,0,0,0,0,0,0,0,8.33,8.33,0,8.33,8.33,0,0,0,0,0,0,0,0,0,0,0,0,0,0,0,0,0,0,0,0,0,0,0,0,0,0,0,0,0,0,0,0,0,0,0,0,0,0,8.33,0,0,0,0,0,0,16.67,8.33,8.33,0,0,0,8.33,0,8.33,0,0,0,8.33,8.33,0,8.33,0,16.67,16.67,0,0,0,0,0,0
I just got my first spam call about my vehicle’s extended warranty!!! I’m living in a meme,0.0,530,1,17,29.85,1,99,,8.5,17.65,82.35,70.59,52.94,23.53,23.53,23.53,0,0,0,0,0,23.53,5.88,5.88,11.76,5.88,11.76,0,0,17.65,5.88,5.88,0,0,0,0,5.88,0,0,0,0,0,0,0,0,0,0,0,0,0,0,0,0,0,0,0,11.76,11.76,0,0,0,0,11.76,0,0,0,0,0,0,0,0,0,0,0,0,0,0,0,5.88,0,0,0,0,0,0,0,0,0,0,5.88,0,0,0,0,0,0,5.88,17.65,0,0,17.65,0,0,0,0,0,5.88,0,5.88,5.88,0,0,0,29.41,0,0,0,17.65,11.76,0,0
"My sisters kid, when we were playing in the living room, told me that I look like ghoul due to my baggy eyes. I love children so much, they make me feel so appreciated and loved, always say the kindest things!",1.0,531,1,41,9.13,40.06,97.82,99,20.5,12.2,95.12,68.29,53.66,24.39,19.51,14.63,2.44,0,0,2.44,4.88,14.63,4.88,0,7.32,2.44,9.76,9.76,0,17.07,2.44,2.44,4.88,4.88,0,0,21.95,2.44,7.32,4.88,2.44,0,0,0,0,0,9.76,9.76,0,7.32,7.32,0,0,0,0,0,24.39,12.2,2.44,0,0,0,4.88,12.2,2.44,0,2.44,0,0,0,0,0,7.32,2.44,4.88,0,0,0,4.88,0,0,0,0,0,0,0,2.44,0,0,0,0,0,0,0,0,0,14.63,9.76,2.44,0,2.44,4.88,0,2.44,7.32,7.32,2.44,0,0,0,0,0,0,14.63,2.44,9.76,0,2.44,0,0,0
Where is the Chancellor? Please check the back of your sofas.,1.0,532,1,11,89.52,99,50.45,,5.5,9.09,100,54.55,54.55,9.09,9.09,0,0,9.09,0,0,0,27.27,18.18,0,9.09,9.09,9.09,0,0,9.09,0,0,9.09,0,0,9.09,9.09,0,0,0,0,0,0,0,0,0,0,0,0,0,0,0,0,0,0,0,27.27,9.09,9.09,9.09,0,0,0,18.18,0,0,0,0,9.09,9.09,0,0,9.09,0,9.09,0,0,0,0,0,0,0,0,0,0,0,0,0,0,0,0,0,0,0,0,0,9.09,27.27,9.09,0,18.18,0,0,0,0,0,9.09,0,0,0,0,0,0,18.18,9.09,0,9.09,0,0,0,0
I entered @grav3yardgirl HUGE BACK TO SCHOOL GIVEAWAY to win a macbook pro &amp; tons of other prizes! CHECK IT OUT HERE! https://t.co/qwNsVghNAc #grav3yardgirl,0.0,533,1,24,97.04,6.61,89.39,83,8,20.83,79.17,50,37.5,8.33,4.17,4.17,0,0,0,0,4.17,8.33,4.17,8.33,16.67,0,4.17,0,0,4.17,8.33,8.33,8.33,0,8.33,0,4.17,0,4.17,0,0,0,0,0,4.17,0,4.17,4.17,0,0,0,0,0,0,0,0,0,0,0,0,0,0,0,0,0,0,0,0,4.17,0,0,4.17,4.17,0,0,4.17,0,0,0,0,0,0,0,0,0,0,0,0,0,0,0,0,0,8.33,0,0,12.5,20.83,4.17,4.17,12.5,0,0,0,0,4.17,0,0,0,0,0,0,0,25,0,0,0,8.33,0,16.67,0
Just caught up with #HolbyCity think I've just about finished crying 😭 @Littlelucyd you were outstanding. You will certainly be missed,0.0,534,1,20,3.8,97.73,89.39,20.23,10,25,95,85,60,15,15,5,0,10,0,0,0,0,0,0,15,20,20,0,0,40,5,5,10,0,10,0,35,0,10,5,0,0,0,5,0,0,10,5,5,5,0,5,0,0,5,0,20,10,0,0,0,0,5,10,0,0,0,0,0,0,0,0,0,0,0,0,0,0,0,0,0,0,0,0,0,0,0,0,0,5,0,0,0,0,0,0,0,10,0,5,5,0,0,0,5,20,0,5,0,0,0,0,0,20,5,0,0,0,5,10,5
Just won 3 cents on HQ words...early retirement here I come 😍,1.0,535,1,12,49.68,6.61,99,99,12,8.33,91.67,66.67,33.33,8.33,8.33,8.33,0,0,0,0,0,0,0,8.33,8.33,0,16.67,0,0,16.67,8.33,8.33,8.33,0,8.33,0,16.67,0,0,0,0,0,0,0,0,0,8.33,8.33,0,0,0,0,0,0,0,0,8.33,8.33,0,0,0,0,8.33,0,0,0,0,0,0,0,0,0,16.67,0,0,8.33,8.33,0,0,0,0,0,0,0,0,0,0,0,0,0,0,0,0,8.33,0,0,16.67,16.67,0,8.33,16.67,0,0,0,8.33,8.33,0,0,0,0,0,0,0,25,25,0,0,0,0,0,8.33
"@ShareZone5 @StockpickB You are a right bundle of laughs to take to the pictures Draft!",1.0,536,1,15,99,96.04,,97.84,15,20,73.33,53.33,46.67,6.67,6.67,0,0,6.67,0,0,0,13.33,13.33,6.67,20,6.67,0,0,0,13.33,0,0,0,0,0,0,6.67,0,0,0,0,0,0,0,0,0,6.67,6.67,0,6.67,6.67,0,0,0,0,0,13.33,6.67,0,0,0,0,6.67,6.67,0,0,0,0,0,0,0,0,0,0,0,0,0,0,0,0,0,0,0,0,0,0,0,0,0,6.67,0,0,0,0,0,0,13.33,0,0,0,0,0,0,0,0,0,6.67,0,0,0,0,0,0,20,0,0,0,6.67,0,13.33,0
you know what’s a novel concept? rapists and sexual assaulters not only ruin the lives of their victims but also THEIR OWN LIVES. yeah. not the victims testifying. maybe if you didn’t want rape accusations then DON’T RAPE. also a novel concept.,1.0,537,1,42,3.52,40.06,84.92,1,7,19.05,97.62,69.05,52.38,11.9,9.52,0,0,4.76,0,4.76,2.38,14.29,9.52,0,2.38,7.14,9.52,14.29,9.52,19.05,4.76,0,9.52,0,0,9.52,28.57,0,23.81,7.14,0,2.38,4.76,0,11.9,0,11.9,0,11.9,0,0,0,0,0,0,0,28.57,14.29,0,0,9.52,4.76,2.38,16.67,0,0,0,0,0,0,0,0,4.76,4.76,0,0,0,0,14.29,0,0,0,0,0,9.52,0,0,0,2.38,0,0,0,0,0,0,0,7.14,4.76,0,0,4.76,0,0,0,2.38,2.38,9.52,0,2.38,0,2.38,0,0,21.43,11.9,0,2.38,0,7.14,0,0
so the royal family is sound with pedophiles but as soon as a mixed race baby comes into it they’re scared ? makes sense 🥴,1.0,538,1,23,47.48,85.5,92.58,1,11.5,4.35,95.65,69.57,52.17,8.7,4.35,0,0,0,0,4.35,4.35,8.7,8.7,0,17.39,8.7,8.7,17.39,0,17.39,8.7,0,8.7,4.35,0,4.35,26.09,0,13.04,4.35,4.35,0,0,0,4.35,0,8.7,0,8.7,4.35,0,4.35,4.35,0,0,0,17.39,4.35,0,0,0,4.35,0,13.04,8.7,0,0,0,0,0,0,0,0,0,0,0,0,0,4.35,0,0,0,0,0,4.35,0,0,0,0,0,0,0,0,0,0,0,4.35,17.39,0,4.35,8.7,0,4.35,4.35,4.35,0,17.39,4.35,0,0,0,0,0,8.7,0,0,4.35,0,4.35,0,4.35
"USA is turning into the 40-something uncle who turns up to the wedding reception, gets drunk &amp; takes the mic from the band to sing Sweet Caroline, but gets all the words wrong.

Highly entertaining but a total fucking train wreck that you’re glad you don’t have to see more often.",0.0,539,1,51,91.99,73.71,21.25,95.42,25.5,13.73,82.35,68.63,45.1,7.84,5.88,0,0,3.92,0,0,1.96,17.65,11.76,1.96,11.76,5.88,1.96,3.92,1.96,19.61,11.76,5.88,1.96,1.96,0,0,17.65,1.96,5.88,0,0,0,1.96,0,3.92,0,11.76,7.84,1.96,3.92,3.92,0,0,0,0,1.96,13.73,5.88,0,0,0,1.96,1.96,9.8,3.92,0,0,1.96,0,0,0,0,3.92,3.92,0,0,0,0,3.92,0,0,0,0,1.96,0,1.96,0,0,0,5.88,3.92,0,0,0,0,0,1.96,13.73,0,3.92,3.92,1.96,1.96,0,1.96,0,15.69,0,0,0,0,0,0,17.65,3.92,3.92,0,0,3.92,5.88,0
"""I'm concerned about the environmental impact of my contact lenses,"" says the occasional daily wearer, throwing their Starbucks cup in the test room bin.",1.0,540,1,24,94.18,18.97,97.72,,24,25,83.33,54.17,37.5,12.5,12.5,8.33,0,0,0,4.17,0,20.83,12.5,0,12.5,4.17,4.17,0,0,8.33,12.5,0,0,0,0,0,25,0,12.5,0,4.17,0,4.17,0,0,0,4.17,0,0,4.17,0,0,0,0,0,0,8.33,4.17,0,0,0,0,4.17,4.17,0,0,0,0,0,0,0,0,8.33,0,4.17,4.17,0,0,4.17,0,0,0,0,0,0,4.17,0,0,0,0,0,0,0,0,0,0,0,20.83,0,0,12.5,8.33,0,0,8.33,0,8.33,0,0,0,0,0,0,25,4.17,8.33,0,0,4.17,8.33,0
I wonder how much wine I’ve drank over the past year,0.0,541,1,11,45.12,1,99,,11,0,100,90.91,54.55,18.18,18.18,18.18,0,0,0,0,0,18.18,9.09,0,9.09,9.09,9.09,0,0,27.27,18.18,18.18,0,0,0,0,54.55,0,18.18,18.18,9.09,0,9.09,0,0,0,0,0,0,0,0,0,0,0,0,0,0,0,0,0,0,0,0,0,0,0,0,0,0,0,0,0,0,0,0,0,0,0,18.18,0,0,0,0,9.09,0,18.18,0,0,0,0,0,0,0,0,0,9.09,9.09,9.09,0,0,9.09,0,0,0,18.18,27.27,0,0,0,0,0,0,0,9.09,0,0,0,0,9.09,0,0
Can’t wait to be back at uni so I can order more shoes and clothes without my mum telling me off x,1.0,542,1,22,12.37,1,79.84,,22,13.64,86.36,68.18,59.09,13.64,13.64,13.64,0,0,0,0,0,9.09,0,0,18.18,13.64,9.09,9.09,4.55,22.73,4.55,4.55,9.09,4.55,0,4.55,13.64,0,13.64,0,0,9.09,0,0,9.09,0,0,0,0,0,0,0,0,0,0,0,9.09,4.55,0,0,0,0,4.55,4.55,4.55,0,4.55,0,0,0,0,0,0,0,0,0,0,0,4.55,0,0,0,0,0,0,0,0,0,0,0,0,0,0,0,0,0,4.55,4.55,0,0,4.55,0,0,0,4.55,0,9.09,0,0,0,0,0,0,4.55,0,0,0,0,4.55,0,0
just expressing my love for brandi carlile and brittney howard that is all,0.0,543,1,13,14.06,7.93,2.93,99,13,23.08,61.54,53.85,53.85,15.38,7.69,7.69,0,0,0,0,7.69,23.08,0,0,7.69,7.69,7.69,7.69,0,7.69,0,7.69,0,0,0,0,15.38,7.69,0,0,0,0,0,0,0,0,7.69,7.69,0,7.69,7.69,0,0,0,0,0,7.69,7.69,0,0,0,0,0,0,0,0,0,0,0,0,0,0,0,0,0,0,0,0,0,0,0,0,0,0,0,0,0,0,0,0,0,0,0,0,0,0,7.69,0,0,0,0,0,0,0,0,0,7.69,0,0,0,0,0,0,0,0,0,0,0,0,0,0
I am so fucking tired of living in the UK.,0.0,544,1,10,69.05,1,98.38,1,10,10,90,80,60,10,10,10,0,0,0,0,0,10,10,0,20,10,10,10,0,20,10,0,0,0,0,0,10,0,0,0,0,0,0,0,0,0,20,0,10,10,0,10,0,0,0,10,0,0,0,0,0,0,0,0,0,0,0,0,0,0,0,0,0,0,0,0,0,0,20,10,0,0,0,0,0,0,0,0,0,0,0,0,10,0,0,0,0,20,0,0,20,0,0,0,0,0,10,0,0,0,0,0,0,10,10,0,0,0,0,0,0
Death by Zara fitting room,1.0,545,1,5,99,,63.35,,5,20,60,20,20,0,0,0,0,0,0,0,0,0,0,0,20,0,0,0,0,0,0,0,0,0,0,0,0,0,0,0,0,0,0,0,0,0,0,0,0,0,0,0,0,0,0,0,0,0,0,0,0,0,0,0,0,0,0,0,0,0,0,0,20,0,20,0,0,0,20,0,0,0,0,0,0,0,20,0,0,0,0,0,0,0,0,0,0,20,0,0,20,0,0,0,0,0,0,0,0,0,0,0,0,0,0,0,0,0,0,0,0
How is my highest grade in A&amp;P,0.0,546,1,9,66.04,2.75,99,,9,11.11,77.78,66.67,55.56,11.11,11.11,11.11,0,0,0,0,0,22.22,11.11,0,11.11,11.11,11.11,0,0,11.11,11.11,0,0,0,0,0,22.22,0,11.11,11.11,11.11,0,0,0,0,0,0,0,0,0,0,0,0,0,0,0,0,0,0,0,0,0,0,0,0,0,0,0,0,0,0,0,11.11,0,0,11.11,0,0,0,0,0,0,0,0,0,0,0,0,0,0,0,0,0,0,0,0,0,22.22,0,0,22.22,0,0,0,0,0,11.11,0,0,0,0,0,0,22.22,0,0,0,0,0,22.22,0
anyone else kinda like how it feels after you floss and ur gums are inflammed,0.0,547,1,15,1.16,99,93.95,,15,6.67,86.67,80,66.67,26.67,13.33,0,0,13.33,0,0,13.33,0,0,0,13.33,6.67,13.33,13.33,0,13.33,6.67,0,0,0,0,0,40,0,33.33,13.33,6.67,0,13.33,0,6.67,0,0,0,0,0,0,0,0,0,0,0,20,0,0,0,0,0,0,20,0,0,0,0,0,0,0,0,0,0,0,0,0,0,6.67,0,0,0,0,0,0,0,0,0,0,0,0,0,0,0,0,0,6.67,6.67,0,0,0,0,0,6.67,6.67,0,13.33,0,13.33,13.33,0,0,0,0,0,0,0,0,0,0,0
"Man-spider. The story of a spider who's bitten by a human and now has the powers of a human. Working in an office, wasting money on artisan coffee, and giving up his bus seat to a woman who turns out not to be pregnant, but just ""likes sandwiches you a-h*le"".
#IntoTheSpiderVerse",1.0,548,1,52,95.45,93.13,11.63,49.66,13,13.46,80.77,63.46,53.85,7.69,7.69,0,0,1.92,1.92,0,0,15.38,13.46,0,17.31,5.77,3.85,5.77,1.92,11.54,3.85,0,3.85,0,1.92,1.92,9.62,0,3.85,0,0,0,0,0,3.85,0,1.92,1.92,0,0,0,0,0,0,0,0,17.31,1.92,0,0,0,0,1.92,15.38,1.92,0,1.92,1.92,0,0,0,0,5.77,0,0,3.85,1.92,0,5.77,1.92,0,0,0,0,1.92,3.85,0,0,0,0,0,0,0,0,0,0,5.77,7.69,0,1.92,5.77,0,0,0,1.92,0,7.69,0,0,0,0,0,0,25,5.77,5.77,0,0,1.92,11.54,0
"For a good laugh, follow me over on @vsheltonsports to see my best attempt at covering sports business news for class this semester.",1.0,549,1,23,99,5.93,44.75,99,23,21.74,86.96,56.52,43.48,13.04,8.7,8.7,0,0,0,0,4.35,13.04,4.35,0,26.09,0,0,0,0,8.7,4.35,0,4.35,0,4.35,0,4.35,0,0,0,0,0,0,0,0,0,8.7,8.7,0,8.7,8.7,0,0,0,0,0,8.7,8.7,0,0,0,0,8.7,0,0,0,0,0,0,0,0,0,17.39,4.35,0,13.04,4.35,0,0,0,0,0,0,0,0,0,0,0,0,0,0,0,0,0,0,0,13.04,8.7,0,0,4.35,4.35,0,0,4.35,0,0,0,0,0,0,0,0,13.04,4.35,4.35,0,0,0,4.35,0
My president https://t.co/xaH8cLpdQV,0.0,550,1,3,10.19,40.06,99,,3,33.33,100,33.33,33.33,33.33,33.33,33.33,0,0,0,0,0,33.33,0,33.33,0,0,0,0,0,0,0,0,33.33,0,0,33.33,0,0,0,0,0,0,0,0,0,0,0,0,0,0,0,0,0,0,0,0,33.33,0,0,0,0,0,0,33.33,0,0,0,0,66.67,33.33,0,33.33,0,0,0,0,0,0,0,0,0,0,0,0,0,0,0,0,0,0,0,0,0,0,0,0,0,0,0,0,0,0,0,0,0,0,0,0,0,0,0,0,0,0,0,0,0,0,0,0,0
"@pamparoni keyboard and mouse weigh nothing the monitors are a little iffy though",0.0,551,1,13,31.07,1,2.93,,13,30.77,69.23,61.54,46.15,0,0,0,0,0,0,0,0,15.38,15.38,0,0,7.69,7.69,15.38,7.69,7.69,7.69,15.38,0,0,0,0,23.08,7.69,7.69,0,0,0,0,0,7.69,0,0,0,0,0,0,0,0,0,0,0,0,0,0,0,0,0,0,0,0,0,0,0,7.69,0,0,7.69,0,0,0,0,0,0,0,0,0,0,0,0,0,0,0,0,0,0,0,0,0,0,0,0,0,0,0,0,0,0,0,0,0,0,7.69,0,0,0,0,0,0,7.69,0,0,0,0,0,7.69,0
watching tik toks at full volume in the middle of the airport should be a federal offense,1.0,552,1,17,99,,12.44,,17,23.53,76.47,76.47,47.06,0,0,0,0,0,0,0,0,17.65,17.65,0,17.65,11.76,0,0,0,11.76,17.65,11.76,0,0,0,0,5.88,0,5.88,0,0,5.88,0,0,0,0,0,0,0,0,0,0,0,0,0,0,0,0,0,0,0,0,0,0,0,0,0,0,5.88,5.88,0,0,0,0,0,0,0,0,0,0,0,0,0,0,0,0,0,0,0,0,0,5.88,0,0,0,0,0,23.53,5.88,0,17.65,5.88,0,0,0,0,0,0,0,0,0,0,0,0,0,0,0,0,0,0,0
"@mjborshell @garygilligan Hasn't he opened a few new hospitals? Oh sorry, maybe it was a new first aid box.",1.0,553,1,19,36.67,14.81,33.61,99,9.5,15.79,84.21,63.16,42.11,10.53,5.26,0,0,0,5.26,0,5.26,15.79,10.53,0,0,10.53,5.26,0,5.26,10.53,21.05,5.26,0,0,0,0,26.32,0,10.53,0,0,0,5.26,0,5.26,0,10.53,10.53,0,0,0,0,0,0,0,0,10.53,5.26,5.26,0,0,0,0,5.26,0,0,0,5.26,0,0,0,0,0,0,0,0,0,0,15.79,15.79,15.79,0,0,0,0,0,0,0,0,0,0,0,0,0,0,0,0,5.26,0,0,5.26,0,0,0,10.53,10.53,5.26,0,5.26,0,0,5.26,0,31.58,5.26,5.26,5.26,0,5.26,10.53,0
Petition to call erections social dickstanding,1.0,554,1,6,99,,,,6,50,66.67,33.33,16.67,0,0,0,0,0,0,0,0,0,0,0,16.67,0,0,0,0,0,16.67,0,0,0,0,0,0,0,0,0,0,0,0,0,0,0,0,0,0,0,0,0,0,0,0,0,33.33,16.67,0,0,0,0,16.67,0,0,0,0,0,0,0,0,0,0,0,0,0,0,0,16.67,0,0,0,0,0,16.67,0,0,0,0,0,0,0,0,0,0,0,16.67,0,0,0,0,0,0,0,0,0,0,0,0,0,0,0,0,0,0,0,0,0,0,0,0
Hands up who remembers when EVERY blogger and their dog was a brand ambassador for Coconut Lane 😂,1.0,555,1,17,46.7,99,46.57,,17,23.53,82.35,58.82,52.94,11.76,11.76,0,0,0,0,5.88,0,17.65,5.88,0,11.76,5.88,5.88,11.76,0,11.76,0,5.88,0,0,0,0,23.53,5.88,5.88,5.88,0,0,0,0,0,5.88,0,0,0,0,0,0,0,0,0,0,17.65,0,0,0,0,0,0,17.65,0,0,0,0,11.76,5.88,0,5.88,0,0,0,0,0,0,11.76,0,0,0,0,0,0,5.88,0,0,0,0,0,0,0,0,0,0,0,5.88,0,0,5.88,0,0,0,5.88,11.76,0,0,0,0,0,0,0,0,0,0,0,0,0,0,5.88
"@adorinqdwt @dwtridesgnf Yes the racist is so cool!!!",1.0,556,1,8,26.1,,,20.23,8,25,75,62.5,37.5,0,0,0,0,0,0,0,0,12.5,12.5,0,0,12.5,12.5,12.5,0,12.5,12.5,0,0,0,0,0,25,12.5,0,0,0,0,0,0,0,0,25,12.5,12.5,0,0,0,0,0,0,0,12.5,12.5,0,0,0,12.5,0,0,0,0,0,0,12.5,0,12.5,0,0,0,0,0,0,0,0,0,0,0,0,0,0,0,0,0,0,0,0,0,0,0,0,0,12.5,12.5,0,0,0,0,0,12.5,0,0,12.5,0,12.5,0,12.5,0,0,62.5,0,0,0,37.5,0,25,0
I just wanna lie in bed and eat skips and get paid for it,0.0,557,1,14,56.86,9.23,2.36,,14,0,92.86,78.57,57.14,14.29,7.14,7.14,0,0,0,0,7.14,0,0,0,21.43,0,7.14,14.29,0,21.43,0,0,0,0,0,0,14.29,0,7.14,0,0,7.14,0,0,0,0,0,0,0,0,0,0,0,0,0,0,7.14,7.14,0,0,0,0,0,0,0,0,0,0,0,0,0,0,14.29,0,7.14,0,7.14,0,7.14,0,0,0,0,0,0,7.14,0,0,7.14,7.14,0,0,0,0,0,0,7.14,7.14,0,0,7.14,0,0,0,0,7.14,0,7.14,7.14,7.14,0,0,0,0,0,0,0,0,0,0,0
Isn't it just amazing how competent the government are. You know everything is fine when we have a trustworthy PM who doesn't blatantly lie through his teeth. Everything is so great right now!!,1.0,558,1,33,1,86.82,13.81,99,11,24.24,93.94,75.76,63.64,21.21,12.12,0,3.03,3.03,3.03,0,9.09,9.09,6.06,0,3.03,18.18,15.15,6.06,6.06,21.21,9.09,0,9.09,6.06,0,3.03,33.33,6.06,9.09,6.06,3.03,0,0,0,3.03,0,12.12,12.12,0,3.03,3.03,0,0,0,0,0,21.21,9.09,0,0,0,6.06,0,12.12,0,0,0,3.03,3.03,3.03,0,0,0,0,0,0,0,0,3.03,0,0,0,0,0,0,0,0,0,0,0,0,0,0,0,0,0,15.15,0,0,0,0,0,0,0,6.06,0,18.18,0,0,0,0,0,0,18.18,6.06,0,0,6.06,6.06,0,0
the time is currently 00:24 and the single thing rattling around in my brain is the noise those door stoppers make. you know the one,0.0,559,1,26,64.84,62.84,94.47,1,13,11.54,92.31,65.38,57.69,15.38,7.69,3.85,0,3.85,0,0,7.69,26.92,15.38,11.54,7.69,7.69,7.69,3.85,0,15.38,3.85,3.85,0,0,0,0,30.77,7.69,7.69,3.85,3.85,0,0,0,0,0,3.85,0,3.85,0,0,0,0,0,0,0,3.85,0,0,0,0,0,0,3.85,0,0,0,0,0,0,0,0,0,0,0,0,0,0,3.85,0,0,0,0,0,0,0,0,0,0,0,0,0,0,0,0,0,11.54,15.38,0,0,11.54,0,3.85,0,7.69,0,11.54,0,0,0,0,0,0,7.69,3.85,0,0,0,0,3.85,0
hi,0.0,560,1,1,,,,99,1,0,100,0,0,0,0,0,0,0,0,0,0,0,0,0,0,0,0,0,0,0,0,0,0,0,0,0,0,0,0,0,0,0,0,0,0,0,100,100,0,0,0,0,0,0,0,0,100,100,0,100,0,0,100,0,0,0,0,0,0,0,0,0,0,0,0,0,0,0,0,0,0,0,0,0,0,0,0,0,0,0,0,0,0,0,0,0,0,0,0,0,0,0,0,0,0,0,0,0,0,0,0,0,0,0,0,0,0,0,0,0,0
"Both kiddos have a cold I don't feel good and now I think my oldest is having stomach issues, oh what a fun night!",1.0,561,1,24,5.64,1,99,99,24,4.17,91.67,79.17,54.17,16.67,12.5,12.5,0,0,0,0,4.17,16.67,8.33,0,0,16.67,4.17,4.17,4.17,25,12.5,4.17,0,0,0,0,29.17,0,8.33,8.33,0,0,0,0,0,0,8.33,8.33,0,8.33,8.33,0,0,0,0,0,0,0,0,0,0,0,0,0,0,0,0,0,0,0,0,0,4.17,4.17,0,0,0,0,4.17,0,0,0,0,0,0,0,0,0,0,0,0,0,0,0,0,0,25,8.33,0,0,0,0,0,8.33,12.5,0,16.67,0,4.17,0,0,4.17,0,12.5,0,4.17,0,4.17,4.17,0,0
"@terryflewers @lfcsonny Has he given any clarification regarding what age Harvey Elliott needs to be before you can tackle him?",1.0,562,1,20,15.41,99,1,,20,25,80,65,50,20,15,0,0,5,10,0,5,5,0,0,10,15,0,5,0,30,0,0,0,0,0,0,40,0,20,5,0,10,5,0,0,0,0,0,0,0,0,0,0,0,0,0,25,10,0,5,0,0,5,15,0,0,0,10,0,0,0,0,0,0,0,0,0,0,0,0,0,0,0,0,0,0,0,5,0,0,0,0,0,0,0,0,0,5,0,5,0,0,0,0,10,5,15,0,0,0,0,0,0,15,0,0,5,0,0,10,0
"The nice thing about being back in school is the sense of stability, the bad part is that it’s being stable in misery.",0.0,563,1,23,72.44,18.24,98.67,1,23,4.35,100,82.61,60.87,13.04,0,0,0,0,0,0,13.04,17.39,13.04,0,17.39,21.74,4.35,0,0,21.74,8.7,4.35,0,0,0,0,21.74,0,8.7,4.35,0,0,0,0,4.35,0,13.04,4.35,8.7,8.7,0,8.7,0,0,0,0,0,0,0,0,0,0,0,0,0,0,0,0,0,0,0,0,4.35,0,0,4.35,0,0,0,0,0,0,0,0,0,0,0,0,0,0,0,0,0,0,0,0,4.35,17.39,0,0,13.04,0,0,4.35,8.7,0,13.04,0,0,0,0,0,0,13.04,4.35,4.35,0,0,4.35,0,0
"Vaccine dose 1. Thank you, science.",0.0,564,1,6,49.68,99,,99,3,33.33,100,50,16.67,16.67,16.67,0,0,16.67,0,0,0,0,0,16.67,0,0,0,0,0,16.67,0,16.67,0,0,0,0,16.67,0,0,0,0,0,0,0,0,0,16.67,16.67,0,0,0,0,0,0,0,0,33.33,16.67,16.67,16.67,0,0,16.67,16.67,0,0,0,0,0,0,0,0,16.67,0,0,16.67,0,0,33.33,33.33,16.67,0,0,0,0,0,0,0,0,0,0,0,0,0,0,16.67,0,0,0,0,0,0,0,0,0,0,0,0,0,0,0,0,0,50,33.33,16.67,0,0,0,0,0
"@kagune_kun despicable tweet, my liege",1.0,565,1,5,39.7,1,63.35,1,5,40,60,40,20,20,20,20,0,0,0,0,0,20,0,0,0,0,0,0,0,0,0,0,0,0,0,0,0,0,0,0,0,0,0,0,0,0,20,0,20,0,0,0,0,0,0,0,40,40,0,0,0,20,20,0,0,0,0,0,0,0,0,0,0,0,0,0,0,0,0,0,0,0,0,0,0,0,0,0,0,0,0,0,0,0,0,0,0,0,0,0,0,0,0,0,0,0,0,0,20,20,0,0,0,60,0,20,0,0,0,40,0
recently started highlighting,0.0,566,1,3,,,99,,3,100,66.67,33.33,0,0,0,0,0,0,0,0,0,0,0,0,0,0,0,0,0,33.33,0,0,0,0,0,0,66.67,0,0,0,0,0,0,0,0,0,0,0,0,0,0,0,0,0,0,0,0,0,0,0,0,0,0,0,0,0,0,0,0,0,0,0,0,0,0,0,0,0,0,0,0,0,0,0,0,0,0,0,0,0,0,0,0,0,0,0,0,0,0,0,0,0,0,0,66.67,33.33,0,0,0,0,0,0,0,0,0,0,0,0,0,0,0
"@Janet67866039 @ermbop Its literally very common. My friends son was concieved while she was in the pill. You do know it's only 91% effective right? That means for 9% of women, that form of birth control fails.",0.0,567,1,37,27.81,96.25,9.25,62.77,9.25,16.22,89.19,59.46,48.65,18.92,8.11,2.7,0,2.7,2.7,0,10.81,13.51,2.7,8.11,10.81,10.81,5.41,2.7,0,16.22,8.11,0,8.11,2.7,5.41,0,16.22,0,5.41,5.41,0,0,0,0,0,0,2.7,2.7,0,0,0,0,0,0,0,0,13.51,0,0,0,0,0,0,13.51,2.7,2.7,5.41,2.7,0,0,0,0,0,0,0,0,0,0,8.11,8.11,0,0,0,0,5.41,0,0,0,0,0,0,0,0,0,0,0,8.11,2.7,0,0,2.7,0,0,0,2.7,5.41,5.41,0,0,0,0,0,0,27.03,8.11,2.7,2.7,0,2.7,10.81,0
"@wfcouncil Hi there, I'm told by the staff at fellowship square on this hot day that there is no cold water provision to full up reusable bottles unless I want to fill up ""from the toilet"" , is that actually my only option?",0.0,568,1,42,63.81,2.06,97.09,57.46,42,14.29,85.71,73.81,57.14,14.29,7.14,7.14,0,0,0,0,7.14,16.67,4.76,0,19.05,7.14,9.52,2.38,2.38,11.9,11.9,4.76,2.38,2.38,0,0,23.81,2.38,9.52,0,0,2.38,2.38,2.38,4.76,0,2.38,2.38,0,0,0,0,0,0,0,0,7.14,4.76,0,2.38,0,0,4.76,2.38,0,0,0,0,0,0,0,0,2.38,0,0,2.38,0,0,0,0,0,0,0,0,0,0,0,0,2.38,0,0,4.76,0,0,0,0,4.76,21.43,0,0,16.67,0,0,4.76,2.38,2.38,7.14,0,0,0,0,0,0,16.67,0,4.76,2.38,0,2.38,7.14,0
"Had an end-of-the-year gathering with my ms coworkers tonight and it was just so nice to be together. 

Get vaccinated, guys.",0.0,569,1,21,18.12,88.15,5.94,88.66,10.5,28.57,95.24,61.9,52.38,9.52,4.76,4.76,0,0,0,0,4.76,9.52,4.76,0,9.52,14.29,9.52,9.52,0,19.05,4.76,0,9.52,9.52,0,0,14.29,0,0,0,0,0,0,0,0,0,4.76,4.76,0,0,0,0,0,0,0,0,14.29,4.76,0,4.76,0,0,0,14.29,0,0,4.76,4.76,0,0,0,0,4.76,0,0,4.76,0,0,4.76,4.76,4.76,0,0,0,0,0,0,0,0,9.52,0,0,0,0,0,0,4.76,0,0,0,0,0,0,0,4.76,9.52,0,0,0,0,0,0,0,28.57,9.52,4.76,0,0,0,14.29,0
I love when you go to shop for plus size clothing and it's always just shoved under women's and it doesn't have any subcategories so u just have to wade thru everything like a pig being thrown slop,1.0,570,1,38,9.05,82.58,70.28,61.63,38,7.89,86.84,73.68,63.16,15.79,7.89,2.63,0,5.26,0,0,7.89,5.26,2.63,0,18.42,10.53,13.16,13.16,2.63,18.42,0,5.26,0,0,0,0,13.16,5.26,2.63,0,0,0,2.63,0,0,0,2.63,2.63,0,2.63,2.63,0,0,0,0,0,10.53,2.63,0,0,0,0,0,7.89,0,0,2.63,0,0,0,0,0,2.63,0,0,0,2.63,0,0,0,0,0,0,0,0,0,0,5.26,0,0,5.26,0,0,0,0,0,7.89,10.53,0,7.89,5.26,0,0,0,5.26,5.26,7.89,5.26,5.26,5.26,0,0,0,7.89,0,0,0,0,7.89,0,0
2021 will u think about me ?,0.0,571,1,6,1,98.75,99,,6,0,100,83.33,66.67,33.33,33.33,16.67,0,16.67,0,0,0,0,0,16.67,16.67,16.67,16.67,0,0,33.33,0,0,0,0,0,0,33.33,0,16.67,16.67,0,0,0,0,0,0,0,0,0,0,0,0,0,0,0,0,16.67,0,0,0,0,0,0,16.67,0,0,0,0,0,0,0,0,0,0,0,0,0,0,0,0,0,0,0,0,0,0,0,0,0,0,0,0,0,0,0,0,0,0,0,0,0,0,0,0,0,0,0,16.67,16.67,16.67,0,0,0,16.67,0,0,16.67,0,0,0,0
"Angela Merkel: doctorate in Quantum Chemistry

Leo Varadkar: worked for years as a GP

Boris Johnson: once accidentally called ping-pong “wiff-waff”",0.0,572,1,21,97.56,,24.32,,21,38.1,42.86,38.1,23.81,0,0,0,0,0,0,0,0,9.52,4.76,4.76,14.29,0,4.76,4.76,0,9.52,0,9.52,4.76,0,4.76,0,19.05,0,0,0,0,0,0,0,0,0,0,0,0,0,0,0,0,0,0,0,4.76,4.76,0,0,0,0,4.76,0,0,0,0,0,0,0,0,0,9.52,0,0,9.52,0,0,0,0,0,0,0,0,0,0,0,0,0,0,0,0,0,0,0,0,4.76,4.76,0,0,4.76,0,0,0,9.52,9.52,0,0,0,0,0,0,0,33.33,0,0,0,0,0,33.33,0
does anyone else buy pound cake in bulk from costco,0.0,573,1,10,69.05,40.06,63.35,,10,0,90,70,50,10,0,0,0,0,0,0,10,0,0,0,20,10,10,0,0,10,10,20,0,0,0,0,30,0,20,0,0,0,10,0,10,0,0,0,0,0,0,0,0,0,0,0,10,0,0,0,0,0,0,10,0,0,0,0,0,0,0,0,10,0,0,0,10,0,10,0,0,0,0,0,0,10,0,0,0,10,0,0,0,0,0,0,10,10,0,0,10,0,0,0,0,0,10,0,0,0,0,0,0,0,0,0,0,0,0,0,0
So kind of the government to introduce 900 new covid tests right before I fly to Paris x,1.0,574,1,18,89.52,13.82,77.17,93.93,18,11.11,88.89,44.44,33.33,5.56,5.56,5.56,0,0,0,0,0,5.56,5.56,5.56,16.67,0,5.56,11.11,0,5.56,5.56,0,5.56,0,0,5.56,27.78,0,16.67,0,0,0,11.11,0,0,0,5.56,5.56,0,0,0,0,0,0,0,0,0,0,0,0,0,0,0,0,0,0,0,0,5.56,5.56,0,0,5.56,0,0,5.56,0,0,5.56,5.56,5.56,0,0,0,0,0,0,0,0,0,0,0,0,0,0,0,5.56,5.56,0,5.56,0,0,0,0,11.11,0,0,0,0,0,0,0,0,0,0,0,0,0,0,0,0
"Sometimes I lay in bed and think of all the ppl on tik tok who shaved their heads to go viral and didn’t and now are just bald, no clout. Wish I knew who they were so I could throw em a like 😢",0.0,575,1,43,14.99,27.38,96.19,,21.5,2.33,88.37,81.4,60.47,16.28,16.28,6.98,0,0,0,4.65,0,11.63,4.65,0,11.63,9.3,6.98,9.3,4.65,23.26,2.33,2.33,0,0,0,0,25.58,4.65,13.95,4.65,0,4.65,2.33,0,2.33,0,0,0,0,0,0,0,0,0,0,0,11.63,0,0,0,0,0,0,11.63,0,0,0,0,0,0,0,0,2.33,0,2.33,0,0,0,4.65,0,0,0,0,0,0,0,0,0,2.33,0,0,0,0,0,0,0,9.3,9.3,0,6.98,6.98,0,0,0,4.65,6.98,4.65,2.33,4.65,4.65,0,0,0,6.98,2.33,2.33,0,0,2.33,0,2.33
Only positive of sitting in traffic for over an hour is catching people picking their noses in the cars next to you. Current count: 4,0.0,576,1,25,99,98.38,99,,12.5,24,96,76,48,8,8,0,0,4,0,4,0,12,8,4,24,4,4,0,0,20,12,8,0,0,0,0,12,0,0,0,0,0,0,0,0,0,0,0,0,0,0,0,0,0,0,0,12,0,0,0,0,0,0,12,0,0,0,0,4,0,0,4,0,0,0,0,0,0,4,0,0,0,0,0,0,0,0,0,0,4,0,0,0,0,0,0,8,32,0,8,24,0,0,0,8,0,8,0,0,0,0,0,0,8,4,0,0,0,0,4,0
everyone pls stop shooting fireworks my dog is scared :(,1.0,577,1,10,15.41,40.06,63.35,1,10,30,70,40,30,20,10,10,0,0,0,0,10,10,0,0,0,10,0,0,0,10,0,0,0,0,0,0,30,10,0,0,0,0,0,0,0,0,30,10,20,20,0,20,10,0,10,0,20,10,10,0,0,0,0,10,0,0,0,0,0,0,0,0,0,0,0,0,0,0,0,0,0,0,0,0,0,0,0,0,0,0,0,0,0,0,0,0,10,0,0,0,0,0,0,0,10,0,10,0,20,20,0,0,0,20,0,0,0,0,0,20,0
"@MailOnline Another misogynistic, homophobic rapper.. how shocking!",1.0,578,1,7,18.12,1,97.09,1,3.5,71.43,71.43,42.86,28.57,14.29,0,0,0,0,0,0,14.29,14.29,0,0,0,0,14.29,0,0,0,14.29,14.29,0,0,0,0,28.57,0,28.57,14.29,14.29,0,0,0,14.29,0,28.57,0,14.29,14.29,0,0,0,0,0,0,14.29,14.29,0,0,0,14.29,0,0,0,0,0,0,0,0,0,0,0,0,0,0,0,0,14.29,0,0,0,0,0,14.29,0,0,0,0,0,0,0,0,0,0,0,0,0,0,0,0,0,0,0,0,0,0,0,0,0,0,0,0,71.43,28.57,14.29,0,14.29,0,14.29,0
who up? who on norco?,0.0,579,1,5,89.52,99,63.35,,2.5,0,80,80,80,40,40,0,0,0,0,0,0,0,0,0,40,0,0,0,0,0,0,0,0,0,0,0,0,0,0,0,0,0,0,0,0,0,0,0,0,0,0,0,0,0,0,0,40,0,0,0,0,0,0,40,0,0,0,0,0,0,0,0,0,0,0,0,0,0,0,0,0,0,0,0,0,0,0,0,0,0,0,0,0,0,0,0,0,20,0,0,20,0,0,0,0,0,0,0,0,0,0,0,0,40,0,0,40,0,0,0,0
